check/platform_depth/results/figures/06.evidence/lead_frequencies.intermediate_mainland.stats.json

{
  "FTO": {
    "cases": 0.291,
    "controls": 0.2066
  },
  "ARL13B": {
    "cases": 0.0342,
    "controls": 0.0114
  },
  "HS3ST3A1": {
    "cases": 0.0835,
    "controls": 0.0388
  },
  "LINC01146": {
    "cases": 0.6865,
    "controls": 0.5884
  },
  "GALNTL6": {
    "cases": 0.0387,
    "controls": 0.0132
  },
  "ARHGEF26-AS1": {
    "cases": 0.0415,
    "controls": 0.0143
  },
  "HLA-DQA1": {
    "cases": 0.2862,
    "controls": 0.3852
  },
  "INPP5D": {
    "cases": 0.0364,
    "controls": 0.0125
  },
  "MFSD11": {
    "cases": 0.06,
    "controls": 0.0254
  },
  "CDH4": {
    "cases": 0.0567,
    "controls": 0.0241
  },
  "SLC44A2": {
    "cases": 0.7264,
    "controls": 0.645
  },
  "PHF20L1": {
    "cases": 0.0419,
    "controls": 0.0179
  },
  "ABI3BP": {
    "cases": 0.1505,
    "controls": 0.0911
  },
  "ALPI": {
    "cases": 0.8833,
    "controls": 0.9311
  },
  "OR13C8": {
    "cases": 0.2542,
    "controls": 0.1824
  },
  "ADARB2": {
    "cases": 0.0059,
    "controls": 0.0385
  }
}

check/platform_depth/results/figures/06.evidence/README.md

## lead_frequencies.intermediate_mainland

Drawn from: `{"FTO": {"cases": 0.291, "controls": 0.2066}, "ARL13B": {"cases": 0.0342, "controls": 0.0114}, "HS3ST3A1": {"cases": 0.0835, "controls": 0.0388}, "LINC01146": {"cases": 0.6865, "controls": 0.5884}, "GALNTL6": {"cases": 0.0387, "controls": 0.0132}, "ARHGEF26-AS1": {"cases": 0.0415, "controls": 0.0143}, "HLA-DQA1": {"cases": 0.2862, "controls": 0.3852}, "INPP5D": {"cases": 0.0364, "controls": 0.0125`